{
  "format_version": "afr-gt/1",
  "fixture_id": "F06",
  "author_note": "Synthetic test fixture, excluded from model inputs.",
  "rule_facts": {
    "amount_within_cap": true,
    "payee_in_registry": true,
    "within_validity_window": true,
    "tool_authorized": true,
    "duplicate_settlements": 1,
    "settled_amount": "8.000000000000000000"
  },
  "expected_category": "Undetermined",
  "must_cite": [
    "EV-b93d6c2b"
  ],
  "must_quote_from": [
    "EV-b93d6c2b",
    "EV-cd11742a"
  ],
  "expected_policy_refs": [],
  "allowed_confidence": [
    "low",
    "medium",
    "high"
  ],
  "allowed_next_states": [
    "No Claim"
  ]
}