{
  "format_version": "afr-gt/1",
  "fixture_id": "F03",
  "author_note": "Synthetic test fixture, excluded from model inputs.",
  "rule_facts": {
    "amount_within_cap": true,
    "payee_in_registry": true,
    "within_validity_window": true,
    "tool_authorized": true,
    "duplicate_settlements": 1,
    "settled_amount": "8.000000000000000000"
  },
  "expected_category": "User-Authorized Action",
  "must_cite": [
    "EV-b2329448"
  ],
  "must_quote_from": [
    "EV-b2329448"
  ],
  "expected_policy_refs": [
    "PC-101"
  ],
  "allowed_confidence": [
    "medium",
    "high"
  ],
  "allowed_next_states": [
    "Under Review"
  ]
}